<xs:schema xmlns:xs="http://www.w3.org/2001/XMLSchema">
    <xs:element name="customer">
        <xs:complexType>
            <xs:sequence>
                <xs:element name="name">
                    <xs:complexType>
                        <xs:sequence>
                            <xs:element name="first" type="xs:string" />
                            <xs:element name="middle" />
                            <xs:element name="last" type="xs:string" />
                        </xs:sequence>
                    </xs:complexType>
                </xs:element>
                <xs:element name="address">
                    <xs:complexType>
                        <xs:sequence>
                            <xs:element name="street" type="xs:string" />
                            <xs:element name="city" type="xs:string" />
                            <xs:element name="state" />
                            <xs:element name="country" type="xs:string" />
                            <xs:element name="postalcode" type="xs:string" />
                        </xs:sequence>
                    </xs:complexType>
                </xs:element>
            </xs:sequence>
            <xs:attribute name="id" use="required" />
        </xs:complexType>
    </xs:element>
</xs:schema>
